display_name,wallet_id,action_bucket,action_rationale,is_hft_like,is_copy_positive,pma_copy_combined_net_30s,avg_copy_edge_net_30s,combined_realized_plus_mtm_pnl_usdc_est,combined_realized_pnl_usdc_est,unresolved_open_mtm_net_pnl_usdc,unresolved_open_forward_30d_net_pnl_usdc,recent_trades_window,recent_sell_share,fast_exit_share_30s,median_holding_seconds,notes
sbinnala,0xc483ee2ce773ae281131382ecc6285c968b88ac8,copy_ready,copyable_and_not_hft,False,True,16371.906666161754,,-646.1556949106637,737.8352818143201,-1383.9909767249837,-1486.0698017249833,,,,,manually approved; local current-market match but thin local coverage
SnowballHustle,0xe36296a42555b95e95880412387e954d84b0bd00,copy_ready,copyable_and_not_hft,False,True,15644.365709365387,,8356.545983478507,8305.960650900744,50.585332577763396,1.3452480000000002,,,,,manually approved; stable pnl profile
MikeMoore,0x5d2f49295387e01a49f0a3e59449ceed791c4adb,copy_ready,copyable_and_not_hft,False,True,15236.546211421617,,-3310.298811250883,-2989.6960889241705,-320.6027223267126,-367.9318173596,,,,,manually approved; stable pnl profile
PetrGrepl,0xe7590338d435112c032e3ea51ff3d08a27a1e7ca,copy_ready,copyable_and_not_hft,False,True,5820.7732841247,,3701.9603872077632,3543.6808497002253,158.27953750753815,,,,,,manually approved; election-cycle specialist candidate
ELICHOU,0x312bcca3bc77bdc1d37dc6db5b9c1493de61cafe,copy_ready,copyable_and_not_hft,False,True,3381.7821593249446,,-2599.2862328085503,94.3630398666618,-2693.649272675212,590.0016503798149,,,,,manually approved despite frequent sells; review as active discretionary trader
